{
  "sample_version": "agentic-flows.sample/v1",
  "flow": {
    "id": "security.secret-leak-response",
    "version": "0.1.0",
    "source": "flows/security/secret-leak-response/flow.yaml"
  },
  "inputs": {
    "report": "An API key may have been committed to a public branch on 2026-06-29.",
    "repo": "https://github.com/RNT56/example"
  },
  "expected_outputs": {
    "response_record": "Containment, rotation evidence, and scope of exposure.",
    "postmortem": "The blameless postmortem with follow-ups."
  },
  "notes": "Contract-first: a completed run needs a runtime wired to the real secret store and the affected systems."
}
